Title;Location;Price;Description
Rumah Siap Huni Semi Furnish Terawat Dan Asri di Budisari;Cidadap, Bandung;Rp 125 Juta per tahun;Disewakan rumah siap huni Budi Sari   Lt 270 Lb 350 Kt 3 Km 4 Hoek Hadap utara Air jetpump Pln 2200w   Harga 125jt/th  Yovie Fame Property
kan Rumah Strategis Bisa Usaha di Sayap Dago;Sayap Dago, Bandung;Rp 800 Juta per tahun;FOR SALE / RENT  Rumah / ruang usaha sayap dago   Luas tanah 1350 mÂ² Luas bangunan 680 mÂ² Kamar 3 + 1 Kamar mandi 2+1 Lebar muka 37...
Rumah Baru Mewah di Podomoro Park Cluster Premium;Bojongsoang, Bandung;Rp 85 Juta per tahun;Disewakan Podomoro Park Bandung, 2 lantai (most premium cluster)  Lb :  159 m² Lt  : 176 m² Kt  : 5 Km: 3 2 lantai  Listrik 2200 watt Air PDAM  H...
Disewakan rumah baru cluster siap huni taman kopo indah 5;Taman Kopo Indah, Bandung;Rp 37,5 Juta per tahun;*DISEWAKAN RUMAH BARU TKI 5*  LT. 102 LB. 70 KT. 2+1 KM. 1+1 Full canopy depan blkg Air submersible  Carport 1 Hadap timur  *Harga 37.5jt/th* *105j...
Rumah Modern Klasik Terawat di Tatar Pitaloka Kota Baru Parahyangan Full Furnished;Kota Baru Parahyangan, Bandung;Rp 175 Juta per tahun;DISEWAKAN Rumah Pitaloka KBP LT 360 m2 LB 215 m2 KT 4 + 1 KM 3 + 1 Listrik 3500 watt 2 lantai Garasi 2 Carport 2 AC 4 unit FULL FURNISHE...
Tubagus Ismail, Dago, Dekat Itb, Unpad, Gedung Sate, Tol Pasteur. Rumah Baru Lux Industrial Di Bandung Utara, Kota Bandung;Dago, Bandung;Rp 375 Juta per tahun;Disewakan Rumah Baru LUX industrial di Tubagus Ismail, Dago, Kota Bandung  Cocok Untuk kantor atau Untuk Tinggal   Luas Tanah 1000m Luas Bangunan 5...
Rumah Siap Huni Modern Minimalis Setraduta ;Setra Duta, Bandung;Rp 125 Juta per tahun;RUMAH BAGUS SETRADUTA  ▪️Bangunan 2 lantai ▪️Luas tanah 196 m² ▪️Luas bangunan 200 m² ▪️Kamar tidur 3+1 ▪️Kamar mandi 3+1 ▪...
Bukan Rumah Standar Lagi Lho Gaes... Cakep Minimalis Modern di Cluster Terfavorite Springville Taman Kopo Indah 5, Layak Jadi Pilihanmu;Bandung Kota, Bandung;Rp 45 Juta per tahun;Bukan Rumah Standar Lagi Lho Gaes... Cakep Minimalis Modern di Cluster Terfavorite Springville Taman Kopo Indah 5, Layak Jadi Pilihanmu  Lt 102 m...
Disewakan Rumah 1 Lantai Full Furnished Di Sariwangi parongpong;Sariwangi, Bandung;Rp 52 Juta per tahun;Disewakan Rumah 1 Lantai full furnished Di Sariwangi-Parongpong  Dengan Luas tanah 140mtr bangunan 75mtr  Fasilitas : Terdapat 4 Kamar Tidur dan 2 ...
Pasti Jatuh Hati Deh. Rumah Baru Dan Lux di Kota Baru Parahyangan;Padalarang, Bandung;Rp 150 Juta per tahun;Pasti Jatuh Hati deh.. Rumah Baru dan Lux di Kota Baru Parahyangan  Luas Tanah240 m2 Luas Bangunan 350 m2 4+2 Kamar Tidur 3+1 Kamar Mandi Listrik 2...
kan Rumah Cantik Strategis di Djunjunan Residence Bandung;Pasteur, Bandung;Rp 85 Juta per tahun;FOR SALE  DISEWAKAN Rumah baru di cluster Djunjunan Residence Samping griya pasteur, strategis bisa tembus jalan baladewa pajajaran.   Daerah ...
Rumah Siap Huni 2 Lantai di sukaluyu, cikutra;Cikutra, Bandung;Rp 98 Juta per tahun;DISEWAKAN   RUMAH BARU di CLUSTER CITRA GREEN GARDEN CIKUTRA  LT 400 mÂ² Lb 410 mÂ²  kamar tidur 4 +1 kamar mandi 4+1  lantai granit ...
Rumah Minimalis Bersih di Batununggal;Batununggal, Bandung;Rp 54 Juta per tahun;Disewa Rumah Minimalis Bersih di Batununggal  Lt 126 m Lb 100 m Kt 3 Km 2 Carport 1 Mobil Taman Harga Sewa 54jt/th Min. 2 Tahun
Rumah Bersih Lingkungan Nyaman di Batununggal;Batununggal, Bandung;Rp 60 Juta per tahun;Disewa Rumah Bersih Lingkungan Nyaman di Batununggal Lt 162 mÂ² Lb 130 mÂ² Kt 3+1 Km 1+1 Carport Listrik 2200W Air Artesis Harga Sewa 60Jt/thn
Rumah pinggir jalan utama ;Awiligar, Bandung;Rp 3 Juta per bulan;DIKONTRAKAN l unit rumah  di jl. Awiligar No. 108A Area awiligar cukang Kawung cikutra pahlawan bandung   Hadap: barat SHM Semi Furnished/  LT: 98m...
Disewakan Rumah Nyaman Semi Furnished Siap Huni di Batununggal, Bandung;Batununggal, Bandung;Rp 125 Juta per tahun;Di sewakan Rumah 2lantai di Batununggal semi furnish   Lt. 240  Lb. 300 Kt  : 3+1 Km: 2+1 Listrik : 5500 Air : pompa submersible Semi furnish: Komp...
Rumah Siap Huni Setrasari;Setra Sari, Bandung;Rp 100 Juta per tahun;Disewakan Rumah Daerah Setrasari pasteur sukajadi  Spesifikasi : Luas Bangunan 300m² Luas tanah  305m² Kamar Tidur : 3+1 Kamar Mandi : 2+1 Listri...
DISEWAKAN Rumah di Grand Kopo Sayap TKI ;Margahayu, Bandung;Rp 25 Juta per tahun;DIJUAL/Disewakan Grand Kopo Parahyangan   LT 87m2 LB sekitar 67m2 Carport + canopy Air Sible  KT 2 Km 1  Harga sewa 25/thn Harga Jual 850jt  Minat ...
For Rent Rumah Minimalis di Batununggal ;Batununggal, Bandung;Rp 67,5 Juta per tahun;FOR RENT  Rumah Batununggal   • LT : 115 m² • LB : 120m² • LM :  6 m • KT : 3 lantai bawah dan 1 lantai atas (bs ruang serbaguna) • KM ...
Disewakan Rumah 2 Lantai Bagus SHM di Jalan Hegarmanah Kulon;Hegarmanah, Bandung;Rp 100 Juta per tahun;Disewakan Rumah 2 Lantai Bagus di Jalan Hegarmanah Kulon LT: 350 m2 LB: 300 m2 2 Lantai 5 Kamar Tidur 3 Kamar Mandi Tanah Luas
